{
  "$schema": "http://json-schema.org/draft-07/schema#",
  "title": "Analysis Request Schema",
  "description": "Schema for analysis module input requests",
  "type": "object",
  "required": [
    "period",
    "tenant",
    "app",
    "route",
    "required_detectors",
    "observed_coverage",
    "required_coverage",
    "detector_errors",
    "high_sev_hits",
    "false_positive_bands",
    "policy_bundle",
    "env"
  ],
  "properties": {
    "period": {
      "type": "string",
      "pattern": "^\\d{4}-\\d{2}-\\d{2}T\\d{2}:\\d{2}:\\d{2}Z/\\d{4}-\\d{2}-\\d{2}T\\d{2}:\\d{2}:\\d{2}Z$",
      "description": "RFC3339 interval start/end"
    },
    "tenant": {
      "type": "string",
      "minLength": 1,
      "maxLength": 64,
      "description": "Tenant identifier"
    },
    "app": {
      "type": "string",
      "minLength": 1,
      "maxLength": 64,
      "description": "Application identifier"
    },
    "route": {
      "type": "string",
      "minLength": 1,
      "maxLength": 256,
      "description": "Route identifier"
    },
    "required_detectors": {
      "type": "array",
      "items": {
        "type": "string"
      },
      "minItems": 1,
      "maxItems": 20,
      "description": "List of required detector names"
    },
    "observed_coverage": {
      "type": "object",
      "additionalProperties": {
        "type": "number",
        "minimum": 0.0,
        "maximum": 1.0
      },
      "description": "Observed coverage per detector (0.0-1.0)"
    },
    "required_coverage": {
      "type": "object",
      "additionalProperties": {
        "type": "number",
        "minimum": 0.0,
        "maximum": 1.0
      },
      "description": "Required coverage per detector (0.0-1.0)"
    },
    "detector_errors": {
      "type": "object",
      "additionalProperties": {
        "type": "object",
        "additionalProperties": true
      },
      "description": "Detector error information"
    },
    "high_sev_hits": {
      "type": "array",
      "items": {
        "type": "object",
        "additionalProperties": true
      },
      "maxItems": 100,
      "description": "High severity hits with taxonomy and scores"
    },
    "false_positive_bands": {
      "type": "array",
      "items": {
        "type": "object",
        "additionalProperties": true
      },
      "maxItems": 50,
      "description": "False positive analysis bands"
    },
    "policy_bundle": {
      "type": "string",
      "pattern": "^[a-zA-Z0-9\\-\\.]+$",
      "description": "Policy bundle identifier"
    },
    "env": {
      "type": "string",
      "enum": ["dev", "stage", "prod"],
      "description": "Environment"
    }
  },
  "additionalProperties": false
}
